{
  "name": "Flutter Kicks",
  "force": "pull",
  "level": "beginner",
  "mechanic": "compound",
  "primaryMuscles": [
    "glutes"
  ],
  "secondaryMuscles": [
    "hamstrings"
  ],
  "instructions": [
    "On a flat bench lie facedown with the hips on the edge of the bench, the legs straight with toes high off the floor and with the arms on top of the bench holding on to the front edge.",
    "Squeeze your glutes and hamstrings and straighten the legs until they are level with the hips. This will be your starting position.",
    "Start the movement by lifting the left leg higher than the right leg.",
    "Then lower the left leg as you lift the right leg.",
    "Continue alternating in this manner (as though you are doing a flutter kick in water) until you have done the recommended amount of repetitions for each leg. Make sure that you keep a controlled movement at all times. Tip: You will breathe normally as you perform this movement."
  ],
  "category": "strength",
  "images": [
    "Flutter_Kicks/0.jpg",
    "Flutter_Kicks/1.jpg"
  ],
  "id": "flutter_kicks"
}
