{
  "name": "Kettlebell Seesaw Press",
  "force": "push",
  "level": "intermediate",
  "mechanic": "compound",
  "equipment": "kettlebells",
  "primaryMuscles": [
    "shoulders"
  ],
  "secondaryMuscles": [
    "triceps"
  ],
  "instructions": [
    "Clean two kettlebells two your shoulders.",
    "Press one kettlebell.",
    "Lower the kettlebell and immediately press the other kettlebell. Make sure to do the same amount of reps on both sides."
  ],
  "category": "strength",
  "images": [
    "kettlebell_seesaw_press/0.jpg",
    "kettlebell_seesaw_press/1.jpg"
  ],
  "id": "kettlebell_seesaw_press"
}
