{
  "name": "Trap Bar Deadlift",
  "force": "pull",
  "level": "beginner",
  "mechanic": "compound",
  "equipment": "other",
  "primaryMuscles": [
    "quadriceps"
  ],
  "secondaryMuscles": [
    "glutes",
    "hamstrings"
  ],
  "instructions": [
    "For this exercise load a trap bar, also known as a hex bar, to an appropriate weight resting on the ground. Stand in the center of the apparatus and grasp both handles.",
    "Lower your hips, look forward with your head and keep your chest up.",
    "Begin the movement by driving through the heels and extend your hips and knees. Avoid rounding your back at all times.",
    "At the completion of the movement, lower the weight back to the ground under control."
  ],
  "category": "strength",
  "images": [
    "Trap_Bar_Deadlift/0.jpg",
    "Trap_Bar_Deadlift/1.jpg"
  ],
  "id": "trap_bar_deadlift"
}
