{
  "name": "Cable Wrist Curl",
  "force": "pull",
  "level": "beginner",
  "mechanic": "isolation",
  "equipment": "cable",
  "primaryMuscles": [
    "forearms"
  ],
  "secondaryMuscles": [],
  "instructions": [
    "Start out by placing a flat bench in front of a low pulley cable that has a straight bar attachment.",
    "Use your arms to grab the cable bar with a narrow to shoulder width supinated grip (palms up) and bring them up so that your forearms are resting against the top of your thighs. Your wrists should be hanging just beyond your knees.",
    "Start out by curling your wrist upwards and exhaling. Keep the contraction for a second.",
    "Slowly lower your wrists back down to the starting position while inhaling.",
    "Your forearms should be stationary as your wrist is the only movement needed to perform this exercise.",
    "Repeat for the recommended amount of repetitions."
  ],
  "category": "strength",
  "images": [
    "Cable_Wrist_Curl/0.jpg",
    "Cable_Wrist_Curl/1.jpg"
  ],
  "id": "cable_wrist_curl"
}
