{
  "name": "Push-Up With Feet Elevated",
  "force": "push",
  "level": "beginner",
  "mechanic": "compound",
  "primaryMuscles": [
    "chest"
  ],
  "secondaryMuscles": [
    "shoulders",
    "triceps"
  ],
  "instructions": [
    "Lie on the floor face down and place your hands about 36 inches apart from each other holding your torso up at arms length.",
    "Place your toes on top of a flat bench. This will allow your body to be elevated. Note: The higher the elevation of the flat bench, the higher the resistance of the exercise is.",
    "Lower yourself until your chest almost touches the floor as you inhale.",
    "Using your pectoral muscles, press your upper body back up to the starting position and squeeze your chest. Breathe out as you perform this step.",
    "After a second pause at the contracted position, repeat the movement for the prescribed amount of repetitions."
  ],
  "category": "strength",
  "images": [
    "push_up_with_feet_elevated/0.jpg",
    "push_up_with_feet_elevated/1.jpg"
  ],
  "id": "push_up_with_feet_elevated"
}
