{
  "name": "Dumbbell Alternate Bicep Curl",
  "force": "pull",
  "level": "beginner",
  "mechanic": "isolation",
  "equipment": "dumbbell",
  "primaryMuscles": [
    "biceps"
  ],
  "secondaryMuscles": [
    "forearms"
  ],
  "instructions": [
    "Stand (torso upright) with a dumbbell in each hand held at arms length. The elbows should be close to the torso and the palms of your hand should be facing your thighs.",
    "While holding the upper arm stationary, curl the right weight as you rotate the palm of the hands until they are facing forward. At this point continue contracting the biceps as you breathe out until your biceps is fully contracted and the dumbbells are at shoulder level. Hold the contracted position for a second as you squeeze the biceps. Tip: Only the forearms should move.",
    "Slowly begin to bring the dumbbell back to the starting position as your breathe in. Tip: Remember to twist the palms back to the starting position (facing your thighs) as you come down.",
    "Repeat the movement with the left hand. This equals one repetition.",
    "Continue alternating in this manner for the recommended amount of repetitions."
  ],
  "category": "strength",
  "images": [
    "dumbbell_alternate_bicep_curl/0.jpg",
    "dumbbell_alternate_bicep_curl/1.jpg"
  ],
  "id": "dumbbell_alternate_bicep_curl"
}
