{
  "name": "All Fours Quad Stretch",
  "force": "static",
  "level": "intermediate",
  "mechanic": "isolation",
  "primaryMuscles": [
    "quadriceps"
  ],
  "secondaryMuscles": [
    "quadriceps"
  ],
  "instructions": [
    "Start off on your hands and knees, then lift your leg off the floor and hold the foot with your hand.",
    "Use your hand to hold the foot or ankle, keeping the knee fully flexed, stretching the quadriceps and hip flexors.",
    "Focus on extending your hips, thrusting them towards the floor. Hold for 10-20 seconds and then switch sides."
  ],
  "category": "stretching",
  "images": [
    "All_Fours_Quad_Stretch/0.jpg",
    "All_Fours_Quad_Stretch/1.jpg"
  ],
  "id": "all_fours_quad_stretch"
}
