{
  "name": "Seated Dumbbell Inner Biceps Curl",
  "force": "pull",
  "level": "beginner",
  "mechanic": "isolation",
  "equipment": "dumbbell",
  "primaryMuscles": [
    "biceps"
  ],
  "secondaryMuscles": [],
  "instructions": [
    "Sit on the end of a flat bench with a dumbbell in each hand being held at arms length. The elbows should be close to the torso.",
    "Rotate the palms of the hands so that they are facing inward in a neutral position. This will be your starting position.",
    "While holding the upper arms stationary, curl the dumbbells out and up, turning the palms out as you lift and keeping your forearms in line with your outer deltoids. Tips:",
    "Only the forearms should move. Continue the movement until your biceps are fully contracted and the dumbbells are at shoulder level. Hold the contracted position for a second as you squeeze the biceps.",
    "Slowly begin to bring the dumbbells back to the starting position as your breathe in. Remember to rotate your arms as you lower the dumbbells so that you can switch back to a neutral grip.",
    "Repeat for the recommended amount of repetitions."
  ],
  "category": "strength",
  "images": [
    "Seated_Dumbbell_Inner_Biceps_Curl/0.jpg",
    "Seated_Dumbbell_Inner_Biceps_Curl/1.jpg"
  ],
  "id": "seated_dumbbell_inner_biceps_curl"
}
