{
  "name": "Bodyweight Squat",
  "force": "push",
  "level": "beginner",
  "mechanic": "compound",
  "primaryMuscles": [
    "quadriceps"
  ],
  "secondaryMuscles": [
    "glutes",
    "hamstrings"
  ],
  "instructions": [
    "Stand with your feet shoulder width apart. You can place your hands behind your head. This will be your starting position.",
    "Begin the movement by flexing your knees and hips, sitting back with your hips.",
    "Continue down to full depth if you are able,and quickly reverse the motion until you return to the starting position. As you squat, keep your head and chest up and push your knees out."
  ],
  "category": "strength",
  "images": [
    "Bodyweight_Squat/0.jpg",
    "Bodyweight_Squat/1.jpg"
  ],
  "id": "bodyweight_squat"
}
