{
  "name": "One-Arm Kettlebell Para Press",
  "force": "push",
  "level": "intermediate",
  "mechanic": "compound",
  "equipment": "kettlebells",
  "primaryMuscles": [
    "shoulders"
  ],
  "secondaryMuscles": [
    "triceps"
  ],
  "instructions": [
    "Clean a kettlebell to your shoulder. Clean the kettlebell to your shoulder by extending through the legs and hips as you pull the kettlebell towards your shoulder. Rotate your wrist as you do so, so that the palm faces forward. This will be your starting position.",
    "Hold the kettlebell with the elbow out to the side, and press it up and out until it is locked out overhead.",
    "Lower the kettlebell back to your shoulder under control and repeat. Make sure to contract your lat, butt, and stomach forcefully for added stability and strength."
  ],
  "category": "strength",
  "images": [
    "one_arm_kettlebell_para_press/0.avif",
    "one_arm_kettlebell_para_press/1.avif"
  ],
  "id": "one_arm_kettlebell_para_press"
}
