{
  "name": "Bent Over Two-Dumbbell Row with Palms in",
  "force": "pull",
  "level": "beginner",
  "mechanic": "compound",
  "equipment": "dumbbell",
  "primaryMuscles": [
    "middle back"
  ],
  "secondaryMuscles": [
    "biceps",
    "lats"
  ],
  "instructions": [
    "With a dumbbell in each hand (palms facing each other), bend your knees slightly and bring your torso forward, by bending at the waist, while keeping the back straight until it is almost parallel to the floor. Tip: Make sure that you keep the head up. The weights should hang directly in front of you as your arms hang perpendicular to the floor and your torso. This is your starting position.",
    "While keeping the torso stationary, lift the dumbbells to your side as you breathe out, squeezing your shoulder blades together. On the top contracted position, squeeze the back muscles and hold for a second.",
    "Slowly lower the weight again to the starting position as you inhale.",
    "Repeat for the recommended amount of repetitions."
  ],
  "category": "strength",
  "images": [
    "bent_over_two_dumbbell_row_with_palms_in/0.avif",
    "bent_over_two_dumbbell_row_with_palms_in/1.avif"
  ],
  "id": "bent_over_two_dumbbell_row_with_palms_in"
}
